text,humor
What do you call a hot dog with a sweater? A chili dog ,True
"Do zombies eat popcorn with their fingers? No, they eat the fingers separately.",True
Why is it always a good idea to pack asparagus when you go camping? In case your other agus breaks. ,True
What do you call a psychic midget who has escaped from prison? A small medium at large ,True
"What did the elephant say to the naked man? ""How do you breath through something so small?"" ",True
You hear about the two guys that stole a calendar? They each got six months.,True
What's red and bad for your teeth? A brick,True
How many 11s does it take to change a lightbulb? 9. 9 11 changed everything.,True
What's the difference between ignorance and apathy? I don't know and I don't care.,True
What's the definition of endless love? Ray Charles and Stevie Wonder playing tennis,True
"Why doesn't Smokey the bear have any kids? Every time his wife gets hot, he smacks her with a shovel.",True
Why do so many American kids die in school shootings? They're not allowed to run in the halls.,True
Who's Kony's favorite rapper? Soulja Boy.,True
What's the difference between Jesus and a picture of Jesus? It only takes one nail to hang up the picture.,True
What's a pedophile's favorite part of a hockey game? Before the first period.,True
Did you hear the one about the streaker who ran naked through a church? The priest caught him by the organ.,True
"How many telemarketers does it take to change a lightbulb? Just one, but they have to do it during dinner.",True
What's the difference between a tornado and a divorce in the south? Nothing. Someone's losing a trailer either way.,True
What happens when you give a politician Viagra? He gets taller. ,True
"I ordered an Asian Hooker, she arrived 2 hours late. She loves me wrong time.",True
"Want to hear a joke about pizza? Nevermind, it's too cheesy. ",True
Why is it called PMS? Because mad cow disease was taken.,True
What do you call a smart blonde? A golden retriever.,True
The frustrated cannibal threw up his hands.,True
"Somebody threw some cheese at me in the supermarket the other day. I thought to myself ""How dairy.""",True
What do you call a girl with one leg? Eileen ,True
How do you make an archaeolgist mad? Give him a bloody tampon and ask him what period its from.,True
How do you make Holy water? You boil the Hell out of it. ,True
Why did Michael Jackson love to shop at Sears? He heard little boy's pants were half off. ,True
What does a Mexican cut his pizza with? Little Caesars,True
What's better than roses on your piano? Tulips on your organ.,True
What's a thesaurus's favorite cereal? Synonym Toast Crunch,True
"What did the left nut say to the right nut? Don't talk to the guy in the middle, he's a dick.",True
What do sperm and politicians have in common? About 1 in every 500 or 600 million have a chance at becoming human.,True
What do terrorists do on vacation? They go waterboarding.,True
What do you call a leper in a jacuzzi? Stew.,True
Why was the pig in the kitchen? It was bacon.,True
What do you call a cow that has had an abortion? Decaffeinated,True
What do you get for stealing a slut's vegetables? Her peas.,True
What do Pink Floyd and Dale Earnhardt Senior have in common? Their last hit was the wall.,True
When does 1+1=3? When you don't use a condom.,True
What's the difference between Princess Diana and Tiger Woods? Tiger Woods has a better driver.,True
What's so good about an Ethiopian blow job? You just know she'll swallow.,True
Do you know how much cocaine Charlie Sheen did last year? Enough to kill 2 and 1/2 men.,True
What does it taste like when you go down on a old lady? Depends...,True
"Mexican and Black jokes are all the same. Once you've heard Juan, you've heard Jamal.",True
Why does Michael J Fox make the best milkshakes? Because he uses the highest quality ingredients.,True
How did the hipster burn his mouth? He ate his dinner before it was cool.,True
What's the difference between sex and golf? In golf one bad hole won't kill you.,True
What do you call a cow that's had an abortion? Decalfinated,True
Why is chili so annoying? Because it's always Jalopeño business.,True
What do you call an alligator in a vest? An investigator!,True
What did Arnold Schwarzenegger say before he began his chess game? I'll be black.,True
Why can't a nose be 12 inches long? Because then it would a foot. ,True
What's long and hard on a black man? The first grade.,True
Did you hear Mary had sex with god for cash? She just wanted to make a little prophet.,True
What gets louder as it gets smaller? A baby in a trash compactor.,True
What do you call a female peacock? A peacunt.,True
Who picks up shit from a seeing eye dog?,True
"What do a burnt pizza, frozen beer, and a pregnant girl have in common? Someone didn't pull it out in time.",True
What's the difference between a joke and two dicks? You can't take a joke.,True
What do you call a prostitute with a runny nose? Full.,True
How can you tell if you're at a bulimic bachelor party? The cake jumps out of the girl.,True
What do you call a gay dinosaur? Megasoreass,True
Why did the sperm cross the road? Because I put on the wrong socks before I went for a walk.,True
What do you do to a chemist after they die? You barium.,True
I've been reading a book about the history of glue. I can't put it down!,True
What do you call an epileptic in a lettuce patch? A seizure salad.,True
How much does a pirate pay for corn? A buccaneer.,True
What kind of monkey can fly? A hot air baboon.,True
Did you hear about the kidnapping? He woke up.,True
Why did Hitler commit suicide? Because he got his gas bill.,True
How do you wake up Lady Gaga? Poke her face.,True
Marriage is like a deck of cards. In the beginning all you need is 2 hearts and a diamond. By the end you wish you'd a club and a spade.,True
How do you make a dead baby float? Add 2 scoops of ice cream. ,True
Michael J. Fox accidentally erases everything he draws on an Etch-a-Sketch.,True
Ever had Ethiopian food? No? Neither have they.,True
What does one lesbian vampire say to the other? See you next month.,True
Why can't you fool an aborted baby? Because it wasn't born yesterday.,True
What did the sadist do to the masochist? Nothing.,True
There are 3 kinds of people. Those who can count and those who can't.,True
"A man gets the words ""I LOVE YOU"" tattooed on his penis. His wife tells him ""Quit putting words in my mouth!""",True
"My love for you is like diarrhea, I just can't hold it in.",True
Why didn't the skeleton ask anyone on a date? He didn't have the guts!,True
Why did the monkey fall out of the tree? Because he was dead.,True
If you spin a Chinese man around a hundred times does he get disoriented?,True
A dwarf got pick-pocketed the other day. How could they stoop so low?,True
"A horse walks into a bar. The bartender asks, ""Why the long face?"" The horse does not respond because it is a horse.",True
What do you call the first Irish woman ever created? The McRib.,True
"What do you tell a woman with two black eyes? Nothing, you already told her twice!",True
Piracy is killing the music industry. You try playing the guitar with a hook.,True
Are you a parking ticket? Because you have fine written all over you.,True
How do pigs get to a hospital? By riding in a hambulance.,True
"A person went to a coffee shop. The waiter asked, ""Do you want your coffee black?"" The person replied, ""What other colors do you have?""",True
Why did the scientist disconnect his doorbell? He wanted to win the Nobel Prize.,True
"A few weeks ago, two cartoonists entered a contest. The result was a draw.",True
Did you hear about the guy who lost his left arm and left leg in a car accident? He's alright.,True
A guy walks into a bar. He's an alcoholic and it's slowly killing his family.,True
What would you get if your donkey ate the legs off my rooster? Two feet of my cock in your ass.,True
What do you call a puppy in a desert? A hot dog. ,True
What is red and bad for your teeth? A brick.,True
How do you clear out a veterans bingo hall? B 52.,True
What do Americans do immediately after winning the World Cup? Turn off the Playstation.,True
What is orange and sounds like a parrot? A carrot.,True
"Where do you find a zebra? 25 letters after A, bra.",True
"What's gray, full of cement, and howls at the moon? A coyote (I just added the cement to make it harder).",True
What does a clock do when its hungry? Go back for seconds.,True
Why do rednecks like Halloween? Because they can Pump-Kin.,True
Have you heard my under construction joke? It's not done yet.,True
"This girl came up to me and said she recognised me from vegetarian club. I was confused, I'd never met herbivore.",True
There's no need for women to behave the way they do on their period. It's an ovary action.,True
I went to Seoul the other day to sell fluorescent markers. It was the highlight of my Korea.,True
Knock knock  Who's there?  Britney Spears  Britney Spears who?  Knock knock  ... Who's there?  Oops I did it again.,True
Who's the coolest guy at the hospital? The ultrasound guy.,True
My wife was gang raped by a group of mimes. They performed unspeakable acts on her.,True
"You can pick your friends and pick your nose, but you can't pick your friend's nose",True
There are 10 kinds of people in this world: those who understand binary and those who don't.,True
"Your head is so big, your ears are in different time zones.",True
Why did Jesus quit playing hockey? He was tired of getting nailed to the boards.,True
My wife is a famous porn star. She would be pissed if she found out.,True
"A priest, a rabbi, and a blind man walk into a bar and the bartender says, ""What is this, some kind of joke?",True
What did the buffalo say to its kid when it went to school? Bison.,True
"Two soldiers are in a tank. One looks at the other and goes, ""Blublublub!""",True
What's brown and rhymes with snoop? Dr. Dre.,True
Whats the difference between two dicks and a joke? You can't take a joke.,True
What's the difference between a mistress and a wife? About 30 pounds.,True
Did you hear about the new pirate movie? It's rated ARRRGH.,True
Why is there such a shortage of teachers in Africa? Teacher's aides,True
What do you call a pig with three eyes. Piiig.,True
What do vegetarian zombies eat? Graaaaaains.,True
"Did you blow bubbles as a kid? Well, he's back in town and wants his money back.",True
"In a Catholic boarding school, how do you know when to go to bed? The big hand touches the little hand.",True
What do ninjas drink? WATAH!,True
"What's big, grey and makes you jump? The elephant of surprise.",True
What do you call four Mexicans in quicksand? Quatro Cinco,True
Why did Gateway computers go out of business? Because they led to stronger and addictive computers.,True
"I used to know a joke about the hippocampus, but I forgot it.",True
A guy walked into a bar. He got a light concussion.,True
What's a Canadian's favorite letter? A.,True
A seal walks into a club. The doorman takes his coat.,True
"My friend was just buried in a cemetery. It's okay, he was dying to get in.",True
Why can't you fool an aborted baby? He wasn't born yesterday.,True
What did the cannibal get when he was late for dinner? The cold shoulder.,True
Why do mermaids wear seashells? They're too big for B-shells and too small for D-shells.,True
What do you call a cow with no legs? Ground beef.,True
Two peanuts walk into a bar. One was a-SALTED.,True
Why didn't the skeleton cross the road? He didn't have the guts for it.,True
What does the Sun drink out of? Sunglasses.,True
What did the dog say to the tree? Bark.,True
What do you call a fish without an eye? A fsh.,True
What does an elephant use for a vibrator? An epileptic sheep.,True
What do you get if you cross a traffic warden with a dog? A barking ticket.,True
Did you hear the one about the Chinese Godfather? He made them an offer they couldn't understand.,True
How many Mexicans does it take to screw in a lightbulb? Only Juan.,True
What's the difference between Santa and Tiger Woods? Santa kept it down to three hos.,True
"A neutron walks into a bar and asks the bartender, ""How much for a beer?"" The bartender says, ""For you, no charge.""",True
How can you tell if your girlfriend is getting fat? She fits into your wife's clothes.,True
How many hipsters does it take to change a light bulb? It's an obscure number you've probably never heard of.,True
"""President Bush is going to visit the Vatican. He says he's looking forward to meeting the Pope and Mrs. Pope.""",True
"What's the temperature in Motown right now? Three degrees, four tops.",True
What did the light bulb say to the switch? You turn me on.,True
What did the Zombie plumber cry? DRAAAAAINS. ,True
Why don't dinosaurs talk? Because they're dead.,True
Never hit a man with glasses. Hit him with a baseball bat. ,True
What's the worst part about two black guys going over a cliff in a van? They were my friends.,True
"Never get into fights with ugly people, they have nothing to lose.",True
War does not determine who is right – only who is left.,True
Women should not have children after 50. Really… 50 children are enough.,True
"What do you call two Mexicans playing basketball? Their names, if you know them. If not just say ""excuse me"".",True
What's red and smells like blue paint? Red paint.,True
"A horse walks into a bar, the barman says, ""Why the long face?"" The horse replies, ""I have cancer.""",True
"If you were a laser, you'd be set on stunning.",True
What's the difference between a mailbox and an elephant's asshole? You don't know? Remind me not to give you a letter to mail.,True
"To my wife in bed - ""Give me a Chilean Miner!"" Her - ""What's that?"" Me- ""Go down to the bottom of my shaft and stay there 'til Christmas!""",True
"Two men walk into a bar, and the third one ducks.",True
"A termite walks into a bar and asks, ""is the bar tender here?"".",True
Did you hear about the constipated accountant? He couldn't budget.,True
A man was hospitalized with 6 plastic horses up his ass. The doctor described his condition as stable.,True
What kind of soup weighs 2000 lbs? Won ton soup.,True
"What did Paris Hilton's left leg say to her right leg? nothing, they're never together. ",True
What do you call a female deer that's pickled? A dill doe. ,True
"What did the prostitute say when she got out of the psychiatrist's shower? Well, that's another load off of my chest.",True
What do you call a leper in a hot tub? Stew.,True
I picked up a hitch hiker. You've got to when you hit them.,True
What do Mexicans and beans have in common? They both smell like beans.,True
What lies at the bottom of the ocean and quivers? A nervous wreck. ,True
why dont vampires bite divorced MEN? beccause they have already been drained dry..,True
Why don't cannibals eat divorced women? They're bitter.,True
"My friend drowned, and at the funeral, we got him flowers in the shape of a life vest. It's what he would have wanted.",True
What's worse than a joke about shit? A joke about shit that's corny.,True
As a kid I was made to walk the plank. We couldn't afford a dog.,True
"What did Santa Claus’s wife say during a thunderstorm? Come and look at the rain, dear.",True
A comedian entered a joke contest and sent in ten of his best one-liners and waited to see if he had won. Sadly no pun in ten did.,True
What do you call a deer with no eyes? No eyed-deer.,True
What do you call a musician without a girlfriend? Homeless.,True
What's brown and sticky? A stick.,True
What do you call cheese that doesn't belong to you? Nacho cheese.,True
Why was the mushroom invited to the party? Because he's a fungi.,True
"There are two fish in a tank. One turns to the other and says, ""Do you know how to drive this thing?""",True
Why don't seagulls fly over the bay? Because then they would be called bagels!,True
A man stole a case of soap from the corner store. The police said he made a clean getaway.,True
Why did the chicken cross the basketball court? He heard the referee was blowing fowls.,True
What do you call a mexican with a rubber toe? Roberto!,True
What's positive about Africa? H.I.V.,True
What's the worst part about having sex with Marilyn Monroe? Maggots.,True
What's worse than finding a worm in you apple? Finding half a worm.,True
What's the worst thing a mother can say to her child? I should have swallowed you when I had the chance!,True
"What's the most successful pickup line ever? ""Does this smell like chloroform?""",True
How do you get a woman to stop giving blowjobs? Marry her.,True
"Whats green, slimy and smells like ham? Kermit the Frog's finger.",True
What's the opposite of Christopher Reeve? Christopher Walken.,True
A baby seal walks into a club...,True
How do you turn a fruit into a vegetable? AIDS.,True
Menstrual jokes are not funny. Period.,True
"Holocaust jokes aren't funny. Anne Frankly, I won't stand for it.",True
Did you hear the joke about the deaf guy who walked into a bar? no! neither did he...,True
How many ADHD kids does it take to screw in a lightbulb? Wanna go see a movie?,True
"A man walks into a bar and says ""ow"".",True
What do you call a bunch of white guys sitting on a bench? The NBA,True
"I like my women like I like my whiskey, Twelve years old and mixed up with coke.",True
"What's the difference between oral sex and anal sex? Oral sex makes your day, anal sex makes your hole weak!",True
What do you tell a woman with two black eyes? Nothing. You done told her twice.,True
"What did the Mexican say when his term paper flew out the window? - ""Where you goin', essay?""",True
"Borrow money from pessimists, they don't expect it back.",True
What's the difference between a musician and a large cheese pizza? A large cheese pizza can feed a family of four.,True
What do you call a black man who fixes your toilet? You call him a plumber you racist!,True
"What did the egg say to the boiling water? It might take me awhile to get hard, I just got laid by this chick.",True
How many feminists does it take to screw in a lightbulb? None. Feminists can't change shit.,True
If you throw a cat out a car window does it become kitty liter?,True
What do you call an Alabama farmer with a sheep under each arm? A pimp.,True
Where does an Irish family go on vacation? A different bar.,True
What is the difference between snowmen and snowwomen? Snowballs,True
What has a whole bunch of little balls and screws old ladies? A bingo machine.,True
What did the cannibal do after he dumped his girlfriend? Wiped his ass.,True
Why don't blondes have elevator jobs? They don't know the route.,True
How can you tell a Sumo wrestler from a feminist? A Sumo wrestler shaves his legs.,True
What do you call a blonde with 2 brain cells? Pregnant,True
What do you call two skunks that are 69ing? Odor eaters,True
Did you hear about the Christmas themed porn? Jesus gets nailed.,True
Yo Mama is so fat it takes 3 warlocks to summon her.,True
"Yo mama is so stupid, it took her two hours to watch 60 minutes.",True
"Yo mama is so worn out, she has to have a baby just to get off.",True
"Yo Mama is so fat, her nickname is ""DAMN!""",True
"Yo mama is so fat, she eats cereal out of a satellite dish.",True
"Yo mama is so fat, she was baptized at Sea World.",True
Yo Mama is so fat she sat on a dollar and made four quarters.,True
"Yo Mama is so fat, I told the bitch to haul ass and it took her two trips.",True
"Yo Mama is so ugly, it affects her self-esteem.",True
Yo Mama is so stupid she enjoys the musical stylings of Nickelback.,True
Yo Mama is so fat she uses the equator as her belt.,True
Yo Mama is so fat that smaller fat people orbit around her.,True
"Yo Mama is so dumb, she got locked in a grocery store and starved to death.",True
"Yo mama is so fat, the back of her neck looks like a pack of hotdogs.",True
"Yo mama is so fat, that when she stepped on a scale, it said ""to be continued""",True
Yo mama is so fat she has diabetes and an increased risk of cardiovascular disease.,True
Yo mama is so fat she needs a passport to roll over.,True
Yo mama is so poor she has the ducks throw bread at her.,True
Yo mama is so old that when I told her to act her own age she died.,True
Yo mama is so desperate she had sex with me!,True
Yo mama is so nasty she brings crabs to the beach.,True
"Yo mama is so nasty I called her to say hello, and she ended up giving me an ear infection.",True
Yo Mama is so fat her BMI is measured in acres.,True
Yo mama is so poor her face is on the front of a foodstamp.,True
"Yo Mama is so fat that when she died and was cremated, her ash caused the cancellation of flights across Europe.",True
Yo mama is so old she has a picture of Jesus in her yearbook.,True
Yo mama is so fat on the sixth day god created her.,True
"Yo mama is so ugly when she joined an ugly contest, they said ""Sorry, no professionals.""",True
"Yo Mama is so ugly, she uses a line of makeup called ""Why Bother"".",True
Yo mama is so fat she eats Wheat Thicks.,True
Yo mama is so hairy you almost died of rugburn at birth.,True
Yo mama is so old she farts dust.,True
Yo mama is so old her social security number is 1!,True
"Yo mama so fat when her beeper goes off, people think she's backing up.",True
Why was 6 afraid of 7? Because 7 8 9.,True
What did the leper say to the prostitute? Keep the tip!,True
Did you hear about the constipated mathematician? He worked it out with a pencil.,True
Why did Michael Jackson start the race 10 minutes late? He wanted to come in a little behind.,True
We live in a society where pizza gets to your house before the police.,True
Crowded elevators smell different to midgets.,True
"A girl went into the doctor's office with a strawberry up her ass. The doctor said I've got some ""cream"" for that.",True
What is invisible and smells like carrots? Rabbit farts.,True
Why was the Energizer Bunny arrested? He was charged with battery.,True
A clear conscience is usually the sign of a bad memory.,True
The fight we had last night was my fault. My wife asked me what was on the TV and I said dust.,True
"Jesus loves you, but everyone else thinks you're an asshole.",True
What do you get from a pampered cow? Spoiled milk.,True
How are an Arkansas Tornado and an Arkansas divorce the same? Somebody's gonna lose a trailer.,True
"If a turtle doesn't have a shell, is it naked or homeless?",True
What happens to a grape when an elephant sits on it? It lets out a little whine.,True
Why don't blind people like to sky dive? Because it scares the dog.,True
Why do golfers wear 2 pairs of pants? In case they get a hole in one.,True
What happened to the kid who chugged 8 cokes? He burped 7up.,True
What kind of shoes are made out of banana peels? Slippers.,True
What did the letter say to the stamp? Stick to me and we'll go places.,True
What is the difference between a Harley and a Hoover? The location of the dirt bag.,True
"When I was in a supermarket I saw a man and a woman wrapped in a barcode. I asked, ""Are you two an item?"".",True
What's the difference between a Jew and a canoe? Canoes tip!,True
"Two tampons walk down the street. Who says hi first. None, they are stuck up cunts.",True
Statistically 6 out of 7 dwarfs aren't happy.,True
Roses are red. Violets are blue. I've got a knife. Get in the back of the van.,True
"What's big, gray, and unimportant? An irrelephant.",True
What's the difference between Tiger Woods and Princess Diana? Tiger Woods has a better driver,True
Why did the Mexican throw his wife off of the roof? Tequila.,True
What did the cheese maker say after his factory was hit by lightning? I've created a muenster.,True
What do you get when you combine a comedian and a whorehouse? A BROFL.,True
I've got my first Gamblers Anonymous meeting tomorrow. I rang them today to check the time. It's ten to one.,True
You hear they're making a movie about constipation? The movie doesn't come out for a while.,True
I was riding a horse and it's leg broke so I had to shoot it. I'm not allowed on the carousel anymore.,True
How do crazy people go through the woods? They take the psychopath.,True
What's Irish and stays out all night? Patio Furniture.,True
How do you find Will Smith in the snow? You look for fresh prints.,True
Why does Snoop Dogg always carry an umbrella? Fo' drizzle.,True
"Two cannibals are eating a clown. One looks to the other and asks, ""Does this taste funny to you?""",True
What famous pig signed the Declaration of Independence? John Hamcock!,True
"What's red, white, blue and green? A seasick Uncle Sam!",True
What do Japanese men do when they have erections? They vote.,True
Where can you find a dog with no legs? Right where you left him.,True
"Two antennas got married. The ceremony was so-so, but the reception was fantastic.",True
"A grasshopper walks into a bar & the bartender goes ""we have a drink named after you"". The grasshopper goes ""you have a drink named Kevin?""",True
Sorry the hiatus folks.  We took a 2 month vacation to be serious.  We're back in full swing though.,True
"Two muffins are in an oven. One of 'em says, ""Wow, it's really hot in here."" The other one says ""Holy shit, a talking muffin!""",True
What do gay horses eat? Heyyyyyyyyyyy!,True
"I quit my job in the helium balloon factory, I refuse to be spoken to in that tone",True
"I was wondering why a frisbee looked bigger as it came closer, then it hit me.",True
"What did the bra say to the hat? You go on a head, I'll give these two a lift!",True
Did you hear about the scarecrow that won a Nobel Prize for being outstanding in his field?,True
"A Buddhist goes up to a hotdog stand and says, ""Make me one with everything.""",True
I was at an ATM and this old lady asked me to help check her balance. So I pushed her over.,True
What did the vampire say to the teacher? See you next period.,True
A sandwhich walks into a bar and the bartender says sorry buddy white breads only.,True
What did the leper say to the prostitute? Keep the tip,True
"A guy walks into a bar and says ""ow""",True
