text,humor
"I asked a Chinese girl for her number. She replied ""Sex! Sex! Sex! Free sex tonight!"" I said ""Wow!"" Then her friend said ""She means 6663629"".",True
Guess who I bumped into in specsavers the other day. Everyone!,True
What's the difference between a chick pea and a potato? You wouldn't pay to have a potato on you.,True
"A Mexican magician tells the audience that he will disappear on the count of three. Uno, dos... then *poof* he disappeared without a tres!",True
Whats the difference between ignorance and apathy? I don't know and I don't care.,True
What noise does a nut make when it sneezes? Cashew.,True
"Two satellites decided to get married. The wedding wasn't much, but the reception was incredible!",True
I like to tease my dyslexic dwarf friend alot. Its not big and its not clever.,True
What do ya call a woman who throws all her bills on the fire? Bernadette,True
"Why was 6 scared of 7? Because 7,8,9",True
My wife accused me of having OCD. I soon put her in her place.,True
How does a politician sleep? First he lies on one side then he lies on the other.,True
What do you do if you see a spaceman? Park in it man.,True
What sort of jam can't you eat? Traffic jam.,True
"Two sausages in a frying pan, one says to the other: ""bloody hell it's hot in here"". The other says ""OMG, A talking sausage!""",True
Make the little things count. Teach midgets maths.,True
Renewable energy. I'm a big fan.,True
What do you call a woman stretched across a tennis court? Annette,True
What do you call a man with a seagull on his head? Cliff,True
"I had to call the Elvis impersonator hotline yesterday. Got told to press, 1 for the money 2 for the show",True
What do you call a man without a spade? Douglas.,True
What do you call a man with a spade? Doug.,True
What's red and white and flies at night? A sanitary owl.,True
Did you hear about the paper boy? He blew away.,True
My neighbour complained to me about my dog chasing people on a bike. My dog can't even ride a bike.,True
What do gay horses eat? Haaaaaaaaayyyyyyyy,True
Dating a girl from the zoo. She's a keeper.,True
I just spent all day looking for a cat with one eye. I think I would of found it if I used both.,True
Why did the scarecrow get an award? He was outstanding in his field.,True
What do you call a cow with no legs? Ground Beef.,True
What do you call a man in the sea with no arms and no legs? Bob,True
An ice cream seller was today found on the floor of his van covered in hundreds and thousands. Police said he topped himself.,True
What's black and white and eats like a horse? A zebra.,True
My wife is a magician. She turned our car into a tree,True
I bought some shoes off of a drug dealer. I don't know what he laced them with but I've been trippin all day.,True
"I got the wife a wooden leg for Christmas, it's not a main present, just a stocking filler.",True
What did the cheese say when it saw it's self in the mirror? Halloumi!,True
How did the cheese paint his wife? He double Gloucester.,True
Dyslexic rules KO,True
What's the best cheese to use if you want to lure a bear out the woods? Camembert.,True
Just invited my friends round for a Vodka party. Everyone was in great spirits.,True
"How many sound technicians does it take to screw in a lightbulb? One two, One two",True
I asked the greengrocer for a bag of onions. He gave me one and said that's shallot.,True
What do you call a parrot under an umbrella? Polly unsaturated,True
When I got home from work I joined all my watches end to end to make a belt. What a waist of time!,True
What did the sea say to boat? Nothing it just waved.,True
I got stung by a bee the other day. £20 for a jar of honey.,True
A dentist and a manicurist married. They fought tooth and nail.,True
I got myself a new job in the telescope factory. Things are really looking up.,True
I was in Tesco the other day and couldn't work out which pasta I needed to buy. Then the penne dropped.,True
How much do cockneys pay for their shampoo? Pantene.,True
Hear about the dyslexic pimp who bought a warehouse?,True
Why can't Stevie Wonder see his friends? Because he's married.,True
Where did Napoleon keep his armies? Up his sleevies.,True
My boyfriend has just got a job as a light switch engineer. Its really turned me on.,True
My girlfriend saw the backseat of my car last night! She said it needed hoovering.,True
"Me: People say I've got a special way of lighting up the roomJudge: It's called arson &amp, those people are witnesses.",True
Tampax have announced that they will be replacing their traditional tampon string with tinsel. This will be for the Christmas Period only.,True
Did you hear about those new corduroy pillowcases? They're making headlines.,True
You cant beat a boiled egg.,True
"Two monkeys in a bath together. First one says: ""Ooh Ooh Ah Ah"" Second one says: ""Best put some more cold water in then"".",True
How do u find Will Smith in the snow? Look for the fresh prints.,True
Whats red and bad for your teeth? A brick.,True
What is Mr T's favourite yoghurt? Petit Filou,True
Why did the alien leave the party? Because the atmosphere wasn't right.,True
"I used to go out with a Dutch girl who wore inflatable shoes, but then she popped her clogs!",True
What's got 8 eyes and 8 legs? 8 pirates.,True
I'd love to have a job cleaning mirrors. It's something I could really see myself doing.,True
What has 20 legs and flys? 5 dead horses.,True
"Had a fight last night with the wife, she threw a lettuce at me! That's just the tip of the iceberg.",True
"I once had a dog called Blacksmith. Every time i kicked it, he made a bolt for the door!",True
There was a fight in the chippy last night! Two fish got battered.,True
"I got offered a 42 inch TV for £25, the only problem is that the volume button doesn't work. For that price though, you can't turn it down.",True
What do you get hanging from apple trees? Sore arms.,True
"What did the girl with no arms get for Christmas? Gloves. Only joking, she hasnt opened her presents yet",True
What invisible and smells like carrots? Rabbit farts,True
What's the fastest type of cake? Scone,True
My horse will only come out of its stable when it gets dark. It's becoming a night mare. ,True
Why did the little girls ice cream melt? She was on fire.,True
A woman looked in the mirror and was shocked to see her first strands of grey hair. She thought she'd dye.,True
What's made of brass and sounds like Tom Jones? Trombones.,True
Why shouldn't you shake hands with Tigger? Because he plays with Pooh.,True
Buying spiders from the pet store costs way more than getting them off the web.,True
What's orange and sounds like a parrot? A Carrot,True
I taught my Dog to play the trumpet on the London Underground. We went from Barking to Tooting in about an hour.,True
"Just been to visit my mates new baby, they asked me if I wanted to wind him. I thought that was a bit harsh, so I just gave him a dead leg.",True
I've got a joke about a tendon but it's a bit close to the bone.,True
Why was the pie waiting on the corner? Because it was meat n potato.,True
What do thieves get for stealing calendars? 12 months,True
My ex girlfriend was a girl called Anna Sthetic. She was a right knockout.,True
I went to a seafood disco last night. Pulled a mussel.,True
Need an ark? I Noah guy.,True
I cut my finger whilst slicing cheese. I have grater problems.,True
What's the difference between virgin olive oil and regular olive oil? Popeye's penis.,True
"How many psychologists does it take to change a lightbulb? One, but that lightbulb has to want to change.",True
"My family think I spend too much time doing dot-to-dot puzzles. But it's okay, I know where to draw the line.",True
What did the female dinosaur call her blouse business? Try Sarah's tops.,True
What do you call a boomerang that won't come back? A stick,True
Becoming vegetarian is a big missed steak.,True
"Two cannibals eating a clown. One turns to the other and says ""This taste funny to you?""",True
"Someone threw a piece of cheese at me in the supermarket, I didn't think it was very mature.",True
I thought I'd lost my dog in London at the weekend. Turns out he was just outside Barking.,True
How do you get Pikachu on a bus? Pokemon.,True
My front door was cheap. Made of foam. You can't knock it!,True
I drank a bottle of cat shampoo last night. Dont ask meow!,True
Why did the little girl fall off the swings? Because she has no arms.,True
What do you call a sheep in the army? Lambo,True
I met the man who invented windowsills. What a ledge.,True
What's E.T. Short for? He's only got little legs!,True
A mummy covered in chocolate and nuts has been discovered in Egypt. Archaeologists believe it may be Pharaoh Roche.,True
"My wife said she was leaving me because of my obsession with ""The Monkeys"". I thought she was joking, then I saw her face.",True
"The wife is cleaning out the cupboards, dirty, filthy and covered in cobwebs. But she's good with the kids!",True
"I told my Mum I'd made a car out of spaghetti, but she didn't believe me! Should of seen her face when I drove pasta.",True
"Went into a record shop and asked if they had anything by The Doors. He said ""yes, a plant and a fire blanket.""",True
What did the bad plant say to the good plant? I've turned over a new leaf.,True
"I had a huge fight with my girlfriend yesterday, but I know she'll come crawling back to me. I stole her wheelchair.",True
Threw the washing machine at the missus. Bosch!!,True
Tea is for mugs.,True
I start my new job in Seoul next week. I thought it was a good Korea move.,True
My wife has left me because she says I keep treating her like a pet. She'll be back when she's hungry.,True
"My dad told me to stop using such high calibre rounds when we were out hunting. As usual, it went in one deer and out the other.",True
I used to have a job as a drill operator. It was well boring.,True
"After complaints about its bright lights, our local Chinese restaurant has agreed to Dim Sum.",True
When a clock is hungry it goes back four seconds.,True
My pet mouse 'Elvis' died last last. He was caught in a trap..,True
The wife asked me to get that spray that will make the curtains smell nicer. Apparently femfresh wasn't it,True
Whats green and smells of pork? Kermits finger.,True
Tried to catch fog yesterday. Mist,True
"What did the 0 say to the 8? ""Nice Belt""",True
Where do fish keep their money? In a riverbank.,True
"What does a Mexican put under his carpet? Underlay, underlay.",True
Why did the Mexican push his wife off a cliff? Tequila!,True
Why did Sepp Blatter cross the road? To get to the other bribe!,True
What the best cheese to hide a horse with? Mascarpone.,True
"One of the best things about living I Sweden? Well, the flag is a big plus.",True
It's a sad day today my best pal died of heartburn. I still can't believe Gaviscon.,True
Whats the difference between a hippo and a zippo? Ones heavy the others a little lighter.,True
Was walking round Tesco's the other day and a bloke threw a big lump of cheese at me! I thought how dairy!,True
I'm going to a deodorant party at the weekend. Roll on Saturday.,True
"Man goes into a chip shop with a salmon under his arm. He says ""Got any fishcakes?"" ""No sorry"" ""Awww that's a shame it's his birthday""",True
Bought myself a universal remote control last night. This could change everything..,True
A clown has been sacked for turning up late for his job at the circus. He is suing for funfair dismissal.,True
What do you call a cowboy with no money? Skint Eastwood.,True
This song is called subtraction Take it away!,True
"A bloke walked into a Fishmongers with a giant condom under his arm. ""A pound a fillet?"" The Fishmonger replied ""A pound you don't"".",True
"Took the shell off my racing snail this weekend. Thought it might speed him up. If anything, it made him more sluggish.",True
"Have you heard about the new Eddie Stobart film coming out? It looks quite good, i've seen the trailer!",True
What's brown and sticky? A stick.,True
Breaking News: Pedigree Chum have gone bust! They've called in the retrievers.,True
Did you hear about the magic tractor? It turned into a field.,True
"Two fish in a tank. One says to the other ""Do you know how to drive this?""",True
If you hold a mackerel to your ear you can just about hear the fishmonger in Morrisons telling you to put the fucker down.,True
What is a pirate's favourite letter of the alphabet? None. Historians have suggested that most pirates would have been illiterate.,True
Why did the Baker have brown hands? Because he kneaded a poo.,True
What's the difference between light and hard? You can go to bed with a light on.,True
"A bloke just ran up to me and said he was going to beat me up with the neck of his guitar! I said, is that a fret?",True
What kind of bees produce milk? Boo-bees.,True
"Roses are red, Violets are blue, I've got dementia, Cheese on toast.",True
Did you hear about the dyslexic agnostic? He didn't believe in Dog.,True
"Got caught having a pee in the local swimming pool today. Lifeguard shouted so loud, I almost fell in...",True
Today my dog 'Minton' swallowed a shuttlecock. Bad Minton!!!,True
Singing in the shower is all fun and games until you get shampoo in your mouth. Then it's a soap opera.,True
Did you hear about the blind circumciser? He got the sack!,True
I used to work in a shoe recycling shop. It was sole destroying.,True
"2 dyslexics are in a kitchen. One says to the other ""can you smell food?"" The other one says ""I can't even smell my own name!""",True
I had a threesome with a scalene and an isosceles. It was a love triangle.,True
Whiteboards. They're remarkable.,True
I'm reading a book about anti-gravity. It's impossible to put down.,True
How do you make a sausage roll? Push it down a hill.,True
"I was arguing with my girlfriend in Nandos when my best mate ran off with the garlic bread &amp, coleslaw! I wish he would stop taking sides.",True
My wife came home from work crying yesterday and asked me to console her. So I hit her over the head with my Xbox.,True
"I used to be addicted to soap, but now I'm clean.",True
"How does Moses make his tea? Hebrews it. I'm serious, that Israeli how he does it.",True
What is E.T. short for? He has really small legs,True
It's real hard being a single mother when you're male and In your mid-twenties.,True
Paying rent is like hitting a snooze button on being homeless.,True
"If an apple is 100% paralyzed , is it considered a fruit or a vegetable?",True
"The happier Asian's get, the less they can see.",True
New study shows that slight overweight women live longer                      Than the men who mention it,True
My coworker keeps showing me pics asking if I've seen her baby. I told her it's been two years and she's not going to find them,True
"I used to do drugs. I still do, but I used to too.",True
Why do you never make fun of a fat girl with a lisp? She's probably thick and tired of it,True
Smoking cigarettes is a great way to commit suicide if you're a procrastinator.,True
"Speeding has never killed anyone. suddenly becoming stationary, now THATS what gets you.",True
Watching Jeopardy backward is like seeing 3 panelists ask questions where Trebek always gets them right,True
"When I'm bored, I call sick into places I don't work, today I'm getting written up at Ross.",True
"What's a pirate's favorite thing to read?
Nothing, he can't.",True
"What's worse than finding a fly in your soup?
This punchline",True
"Saw a raggedly dressed boy in the street and asked if he was an orphan. ""what gave me away?"" He asked, I said, ""your parents""",True
"I came across a hooker who'd do anything for $50
Guess who got the porch repainted?",True
"I try to teach my mom something new every day, because you're supposed to learn from your mistakes",True
I wanted to marry my English teacher when she got out of prison.. But apparently you can't end a sentence with a proposition,True
If a wipe down my vacuum with a paper towel.. That makes me a vacuum cleaner.,True
Did anyone wake green day up?,True
"If the gas station is 2 miles away and my dad can drive at 60MPH, why hasn't returned from getting snacks for 6 years?",True
So glad I don't have to  hunt for food. I don't even know where sandwiches live.,True
What do you call crystal clear urine? 1080pee,True
Is it bad to hate a certain race? Because I absolutely loathe Rainbow Road.,True
If you're an astronaut and don't break up with someone by saying ' I need some space ' you're wasting everyone's time.,True
Just designed a website for orphans. There is no Home page.,True
"Two deer walk out of a gay bar. One turns and says to the other, ""I can't believe I just blew 30 bucks in there.",True
"Which came first, the chicken or the egg?

Neither, the rooster did",True
"What did the kid with no hands get for Christmas?

Gloves.

Just kidding, he hasn't gotten the box open yet.",True
I have to use a stepladder since my real ladder left when I was young.,True
Why can't orphans play baseball? They don't know where home is.,True
Why do orphans play tennis? Cause it's the only love they can get.,True
My grandfather has the heart of a lion and a life ban from the zoo.,True
What do you call a boomerang That doesn't come back? A stick,True
Bought a cake for my girlfriend and wrote 'I'm baking up with you' on it.,True
Why don't black people get sunburned? Because most prisons are indoors.,True
If you wait for the waiter to return..Doesn't that MAKE you the waiter?,True
"Australians don't have sex, they mate.",True
"While cooking breakfast I asked my girlfriend how she likes her eggs, she said fertilized. 😶",True
Why is Peter Pan always flying? Cause he neverlands haah,True
Why do sorority girls walk in odd-numbered packs? Because they can't even.,True
The best part about dead baby jokes is they ever get old,True
"What's the hardest part of a vegetable to eat?
The wheelchair",True
"I broke my pinky today. It hurts, But on the other hand, I'm just fine.",True
"What do you call a Jewish pokemon trainer? 

Ash",True
How do you know if lady gaga is dead? You poke her face,True
What happens if Pinocchio says 'My nose will now grow'?,True
What do you get when you cross a joke and a rhetorical question?,True
So two dyslexics walk into a bra.,True
So I saw a magic tractor today. It was driving down the street and turned into a field.,True
"So two fish are in a tank and one turns to the other and says, ""How do you drive this thing?""",True
Whoever invented knock knock jokes should win a no bell prize.,True
"How does a medium talk with shoes?
She converses",True
"Three years ago today  I asked a beautiful girl to go on a date. Today I asked her to be my wife.
She said no both times.",True
"What is it called when you kill your friend? Homiecide.

Or murder",True
If tomatoes are fruit then isn't ketchup actually a smoothie?,True
What if soy milk is just regular milk introducing itself in Spanish?,True
How come you can drink a drink but not food  a food?,True
What did the homeless man get for Christmas? Frostbite.,True
"Once you have a PhD, every meeting you go to is a doctor's appointment.",True
"Random thought, I've never seen an Asian woman pregnant.",True
"I once asked a pretty homeless woman If I could take her home. She said yes, but you shoulda seen her face when I took her box!",True
Walk into the building like whaddup I got a oh no I'm so sorry wrong building please continue with your funeral God bless,True
I really want to buy one of those grocery checkout dividers but the checkout lady keeps putting it back.,True
Want a stable relationship? Get a horse!,True
Will Smith really looks like that guy from Fresh Prince of Bel-Air.,True
What do you call fly with no wings? A walk! Hahaha.. Heh .,True
Plugs keep bending? Straighten the outlet with a fork!,True
I gave Easter candy to my roommates and I'm officially dubbed the mom of the apartment now.,True
I'm a social vegan. I avoid meet.,True
Why aren't iphone chargers called apple juice?,True
#instagram : Made for people who don't want to beg for friends on Facebook.,True
I wonder if King-sized sheets are called Presidential-sized sheets in Europe..,True
There's 364 more days until Christmas and people already have their Christmas lights up. Unbelievable.,True
"New food naming trend at the office, today i ate a sandwich named Steve.",True
Introducing free idiot tests! Only $5!,True
Do homeless people understand knock knock jokes?,True
"staring from a distance counts is flirting, right?",True
I hate living where I do. I used to think 55 degrees is cold now I think 18 degrees is warm.,True
I often worry that mankind is going to start world war 3 solely because we enjoy trilogies.,True
paused Willy Wonka and the Chocolate Factory to go buy a Snickers. This is why I can't watch breaking bad.,True
My new years resolution is to remember...umm...,True
Sometimes I cry when cutting carrots just so the onions don't think they are ugly or something.,True
"to this day, the boys at that used to bully me and take my lunch money still does. on the plus side, he makes great Subway sandwiches.",True
Why can't someone look at me the way i look at French fries..,True
I remember 2012 like it was yesterday..,True
Just illegally downloaded a video while here in Jamaica. Does that make me a pirate of the Caribbean?,True
"Don't worry, Mayans. If you get it wrong, it's not the end of the world.",True
Lost my mood ring.. Not sure how I feel about this.,True
I never finish anyth,True
"Once upon a time, computers were only used for Paint and Space Pinball.",True
"Myth:

It is said to be that once the 'M' in MTV once stood for music.",True
Of course I talk to myself. Sometimes I need an expert opinion.,True
Of course gay men dress well. They didn't spend all that time in the closet doing nothing.,True
"To girls who say all men are the same, nobody said you had to try them all.",True
"There are two deaf blokes Sat at each end of the bus, signing each other wildly. I'm fighting the urge to ask them to keep it down.",True
I'm writing a joke about a guy's first day at FedEx but I just can't get the delivery right.,True
I saw some ducks practicing their teenage girl faces at the pond today.,True
If Eve doomed the human population for an apple.. What would she do for a Klondike?,True
"Money can't buy happiness, but I'd much rather cry in a mansion.",True
All girls that are 13-17 look exactly the same now. #college,True
"If anyone is interested, I'll be signing books tomorrow at Barnes &amp, Noble from 6 PM until I'm escorted out by security.",True
I like to freak my dentist out by seductively licking his fingers during procedures.,True
My wallet is so fat it's uncomfortable to sit. #richpeopleproblems,True
Halo 4: Saving more Teen pregnancies than Trojan.,True
"Ugh, stewardess wants us to turn off our portable electronics. Knew I should've brought my full desktop PC for this flight.",True
"I've gotta stop saying ""How stupid can you be?"". Too many people are taking it as a challenge.",True
"If you're having a bad day, just remember that someone has to clean the bathroom at Taco Bell.",True
They say nothing rhymes with orange. They're wrong. Nothing doesn't rhyme with orange.,True
I just got gas for $1.39 today at lunch! Gotta love Taco Bell.,True
"I walked into the boss's office and handed him a pear. He asked,Whats this for? A pay rise.My wife told me to grow it first and then ask u",True
I'm pretty sure Dora the Explorer is the maid on Family Guy.,True
"My homework brings all the Asians to the yard, and they're like, it wasn't that hard.",True
"My boss:Ive noticed u nodding off during meetings recently.r u getting enough sleep?
Me:Not really,the meetings are a lot shorter these days",True
I keep a baseball bat under the bed just in case someone breaks in and pitches a ball to me.,True
Today I am running around the park and putting sprinkles on dog crap so people's days aren't ruined.,True
For Halloween this year I think I'm gonna go around to all the hospices and retirement homes and put up cemetery wallpaper.,True
I have a fear of speed bumps..but I'm slowly getting over it.,True
What if Taylor Swift and Adele started dating and then broke up?,True
Guys that try to pick up girls on Twitter are pathetic. Girls If you agree message me your number and we can talk about it.,True
"My advice to men, marry someone who looks sexy disappointed.",True
The reason I wish I was in a gang would be so I know what to do with my hands in pictures.,True
Snooki's son is going to hate it when his friends discover Yo mama jokes.,True
I don't know why people want white iPhones... Everyone knows blacks run faster than whites.,True
"Some girl yelled at me ' you're so hot!!' today on the street. Dont believe me? Ask Brad Pitt, he was Standing Right behind me.",True
I think I'm gonna get a cat just to blame it all the time for being a pussy.,True
"If guns don't kill people, people kill people, does that mean that toasters don't toast toast, toast toast toast?",True
Did you just throw sodium chloride at me?! That's assault!,True
They say there are a lot of scammers on the Internet! And for only $19.95 a month I can show you how to stop them!,True
I prefer not to think before speaking. I like being just surprised as everyone else by the crazy stuff that comes out of my mouth.,True
I hate when I'm standing there trying to be handsome when some other guy comes and stands next to me and challenges my handsomeness.,True
"Tired of lacing shoes? Just replace them with earphones! They'll magically get knotted up every time, guaranteed.",True
Sometimes I forget how to spell a word and I change the entire sentence just to avoid using that word.,True
What if oxygen lowers your voice and helium brings it back to normal?,True
The worst thing about having more money than sense is probably the fact I don't have very much money.,True
"I gotta dig bick. You that read wrong. That awkward when you read that wrong also. And said ""moment"" after awkward. This is awkward.",True
